,Description,Sentiment,Subject
1404,"Guo Wengui, a self-exiled Chinese business tycoon whose criticism of the Communist Party won him legions of online followers and powerful friends in the American conservative movement, was convicted by a U.S. jury Tuesday of engaging in a massive multiyear fraud that ripped off some of his most devoted fans.",positive,
1405,"Investment worth £30billion and tax receipts totalling £20billion could also be lost by 2029, according to the Aberdeen Chamber of Commerce.",positive,
1406,"Samsung has had a busy time lately. Last week it launched a swag of new tech including the Galaxy Ring, Buds 3/3 Pro, sixth generation Z Fold and Z Flip foldables, and new smartwatches. In the midst of this, rumours are circulating about the upcoming Galaxy Tab S10 series comprising a Tab S10+ and Ultra... Read More",positive,
1407,"To honor their Palestinian heritage, the Gaith brothers—Majdi, Noor and Sami—named their coffee roasting business and newly opened cafe, Jaffa Coffee Roasters. The historic port city of Jaffa, Sami said, is considered a “crown jewel” to Palestinians around the world. “It’s the epicenter of music, arts, language and agriculture in the northern part of Palestine,” [&#8230;]",positive,
1408,"(marketscreener.com) PHOENIX, July 16, 2024 /PRNewswire/ -- Trinity Capital Inc. , an internally managed business development company, today announced that it has priced an underwritten public offering of $100.0 million in aggregate principal amount of 7.875% notes due 2029 . The Notes will mature on September 30, 2029, and may be redeemed in whole or in part at...https://www.marketscreener.com/quote/stock/TRINITY-CAPITAL-INC-118392354/news/Trinity-Capital-Inc-Prices-Offering-of-100-0-Million-of-7-875-Notes-due-2029-47395306/?utm_medium=RSS&utm_content=20240716",positive,
1409,"(marketscreener.com) Japanese manufacturers became more confident about business conditions in July whereas those in the service sector cooled, the monthly Reuters Tankan survey showed on Wednesday, reflecting a patchy economic outlook. The poll of 506 large non-financial firms comes two weeks before the Bank of Japan holds its July 30-31 policy...https://www.marketscreener.com/quote/currency/EURO-JAPANESE-YEN-EUR-JPY-4592/news/Japan-s-mixed-business-sentiment-highlights-patchy-economic-outlook-47395280/?utm_medium=RSS&utm_content=20240716",positive,
1410,Arkangelo's family believes he was showing the police officer a utility knife he often carried when he worked with his brother's landscaping business moments before he was shot,neutral,
1411,"Right in the heart of the RNC is Convention Fest, a chance for local business owners to share their talents to a global audience.",positive,
1412,"(marketscreener.com) -U.S. trucking firm JB Hunt Transport Services reported a 24% fall in second-quarter profit on Tuesday as a result of continued weakness in their truckload and intermodal businesses. In the United States, the trucking industry has continued to follow a downward trend since 2022 owing to higher...https://www.marketscreener.com/news/latest/JB-Hunt-s-profit-falls-24-on-continued-industry-headwinds--47395022/?utm_medium=RSS&utm_content=20240716",negative,
1413,"Torrential rains walloped Toronto on Tuesday, turning major roadways into rivers, causing massive traffic jams, huge power outages, disrupting public transit, flooding homes and businesses and sending raw sewage into the streets from overflowing sanitary sewers. But in a broader sense, it was just Toronto’s turn because cities across Canada are experiencing the same natural [&#8230;]",positive,
1414,"The Senate is scheduled to be in session on Wednesday [July 17], and the statements listed on the Order Paper include Cup Match 2024, Emancipation 2024 – Snapshots of our Past and the Bermuda Monetary Authority Annual Report 2023. The Order of Business follows below [PDF here]: Related Stories OBA Announce Dion Smith As C27 [&#8230;]",neutral,
1415,"The Barbados Water Authority (BWA) will be installing a meter in Haymans, St Peter tomorrow, Wednesday, July 17 between 1 p.m. and 5 p.m. As a result, residents and businesses in Haymans, Warleigh, Clarkes Gap, Ashton Hall, Rockless, The Rock and surrounding districts may experience low water pressure or a water outage during this time. [&#8230;]The post BWA to install a meter in Haymans, St Peter appeared first on nationnews.com.",positive,
1416,"Local officials on Tuesday attended Democratic Congressman Raja Krishnamoorthi’s ceremonial presentation of $500,000 in federal funding he secured toward a planned $18.9 million improvement of Central Road serving Bell Works Chicagoland and other businesses in Hoffman Estates and South Barrington.",negative,
1418,"(marketscreener.com) The law firm of Kirby McInerney LLP is investigating potential claims against Arbor Realty Trust, Inc. . The investigation concerns whether Arbor and/or certain of its officers have violated the federal securities laws and/or engaged in other unlawful business practices.[Click here to learn more about the investigation]On July 12, 2024,...https://www.marketscreener.com/quote/stock/ARBOR-REALTY-TRUST-INC-11503/news/Kirby-McInerney-LLP-Announces-Investigation-of-Shareholder-Claims-Against-Arbor-Realty-Trust-Inc--47395151/?utm_medium=RSS&utm_content=20240716",positive,
1419,"Episode 434 — July 16, 2024 Were you too busy to keep up with the last couple of days of Pittsburgh Steelers news and don’t know where to start? I’ll catch you up on “The Depot 180.” From player news to the transaction wire, I will get you up to speed in a quick three-minute [&#8230;]",positive,
1420,"Joe Biden and Donald Trump are two presidents with unfinished business and an itch to get it done.Their track records and plans on abortion, immigration, taxes, wars abroad — you…",neutral,
1421,An ecologist noticed indigenous forest had been cleared and reported it.,neutral,
1422,A murder trial being held in Forsyth County has ended in amistrial.,neutral,
1423,"(marketscreener.com) Petro-Canada, a Suncor Energy business, is extending its longstanding partnerships with the Canadian Olympic Committee and the Canadian Paralympic Committee, which will ensure ongoing support of Canadian athletes, coaches and athletes' families for another eight years. The support continues Petro-Canada's recognition as a National Partner of the...https://www.marketscreener.com/quote/stock/SUNCOR-ENERGY-INC-1411810/news/Suncor-s-Petro-Canada-TM-Extends-Team-Canada-Olympic-and-Paralympic-Partnerships-through-2032-47395068/?utm_medium=RSS&utm_content=20240716",neutral,
1424,"On Monday, Kings County Superior Court Superior Judge Kathy Ciuffini issued a temporary restraining order against the State Water ResourcesThe post Kings County judge issues restraining order allowing probationary farmers to pump without metering appeared first on The Business Journal.",positive,
1425,"The Logan County Chamber of Commerce welcomed Mountain Vista Cleaning Services, LLC with a ribbon-cutting ceremony on Tuesday Owned by Amber Robinson, the business was opened in April 2010 in the Front Range and in August 2020, they expanded their services to Northeast Colorado to offer the community the same level of professionalism and cleanliness. [&#8230;]",positive,
1426,"(marketscreener.com) U.S. trucking firm JB Hunt Transport Services reported a 24% fall in second-quarter profit on Tuesday as a result of continued weakness in their truckload and intermodal businesses. In the United States, the trucking industry has continued to follow a downward trend since 2022 owing to higher capacity, lower rates and no...https://www.marketscreener.com/quote/stock/JB-HUNT-TRANSPORT-SERVICE-9769/news/JB-Hunt-s-profit-falls-24-on-continued-industry-headwinds-47395022/?utm_medium=RSS&utm_content=20240716",positive,
1427,"(marketscreener.com) DALLAS, July 16, 2024 /PRNewswire/ -- Jacobs has announced that a Form 10 has been publicly filed with the U.S. Securities and Exchange Commission for the previously announced&nbsp;planned spin-off of its Critical Mission Solutions and portions of its Divergent Solutions business, including the Cyber &amp; Intelligence business. Filed under...https://www.marketscreener.com/quote/stock/JACOBS-SOLUTIONS-INC-13160/news/Jacobs-Announces-Filing-of-Form-10-Registration-Statement-for-Planned-Spin-Off-of-Critical-Mission-S-47394994/?utm_medium=RSS&utm_content=20240716",negative,
1428,"Since its inception in 2016, Uber Eats has experienced explosive growth. Yet this didn't come without a price. In her new research, Yue Maggie Zhou, associate professor of strategy, explores how Uber Eats has cannibalized Uber's core business, reducing rideshare trip volumes for both Uber and Lyft.",positive,
1429,"NHRA fans will want to bookmark July 25-27, 2025 for Sonoma Raceway. The raceway announced this week that it will retain its usual July date in 2025. This will mark the 37th year of the event at one of the most coveted locations on the schedule. Sonoma Raceway will host the best in the business [&#8230;]",positive,
1430,"The news publication’s annual ‘Best of Richmond’ awards asks local readers to select the businesses and services they feel highlight the best the city has to offer VANCOUVER, British Columbia, July 16, 2024 (GLOBE NEWSWIRE) &#8212; Sandman Hotel Vancouver Airport is thrilled to announce their selection as the first-place winner of the strongly contested ‘Best [&#8230;]",positive,
1431,"(marketscreener.com) Donald Trump will not seek to remove Federal Reserve Chair Jerome Powell before the central banker's term ends and would consider JPMorgan CEO Jamie Dimon for Treasury secretary if he won the Nov. 5 election, the former president told Bloomberg in an interview published Tuesday. https://www.marketscreener.com/business-leaders/Jamie-Dimon-2566/news/Trump-says-weighing-Dimon-for-Treasury-would-allow-Powell-to-finish-term-Bloomberg-reports--47394941/?utm_medium=RSS&utm_content=20240716",neutral,
1432,"Katie Couric (L) and Ozy CEO and Co-Founder Carlos Watson speak onstage during Ozy Fest 2017 | Photo by Bryan Bedder/Getty Images for Ozy Fusion Fest 2017 Carlos Watson and the now-shuttered Ozy Media startup he co-founded were found guilty of fraud by a federal jury on Tuesday, as reported earlier by The New York Times. Over the course of a several weeks-long trial, the jury heard the government’s claims that Ozy Media misled investors by falsifying financial records, inflating audience numbers, and even making up business deals.Watson, the former CEO of Ozy Media, co-founded the company...",negative,
1433,"(marketscreener.com) Shares of technology companies fell slightly as traders rotated out of the 2024 leaders into laggards such as industrial and materials sectors that have more to gain from a rate cut in the coming months. The Roundhill Magnificient Seven exchange-traded fund, which tracks the seven largest tech companies, those responsible for the majority...https://www.marketscreener.com/business-leaders/Elon-Musk-1364/news/Tech-Down-Slightly-on-Sector-Rotation-Tech-Roundup--47394853/?utm_medium=RSS&utm_content=20240716",positive,
1434,"(marketscreener.com) Shares of industrial and transportation companies rallied as traders priced in a rate cut in the coming months. Elon Musk said he's moving the headquarters of two of his companies, social-media concern X and aerospace giant SpaceX, to Texas from California, following in the footsteps of Tesla as the billionaire protests against identiy...https://www.marketscreener.com/business-leaders/Elon-Musk-1364/news/Industrials-Gain-on-Rate-Cut-Hopes-Industrials-Roundup--47394823/?utm_medium=RSS&utm_content=20240716",neutral,
1435,"Fresno County’s 2024 assessment roll grew 5.53%, or $6 billion annually, for a total of $115.9 billion in total netThe post Fresno County assessment roll grows 5%, or $6B annually appeared first on The Business Journal.",positive,
1436,"(marketscreener.com) GALLIPOLIS, Ohio, July 16, 2024 /PRNewswire/ -- On Tuesday July 16, 2024, Ohio Valley&nbsp;Banc Corp. [Nasdaq: OVBC] Board of Directors declared a cash dividend of $0.22 per common share payable on Aug.10, 2024, to shareholders of record as of the close of business on July 26, 2024.&nbsp;""2024 with all its ups, downs and 90&deg; heat is moving...https://www.marketscreener.com/quote/stock/OHIO-VALLEY-BANC-CORP-10379/news/OVBC-ANNOUNCES-CASH-DIVIDEND-47394652/?utm_medium=RSS&utm_content=20240716",negative,
1438,The victim was shot at his workplace in Industry and died at the scene on Monday morning.,negative,
1439,"The tech company's reported decision to sack its internal DEI team led the team's leader to slam the company, claiming the brand ceased caring as it was 'no longer critical.'",neutral,
1440,The song originally appeared as an interlude on Sampha's album 'LAHAI.',positive,
1441,"(marketscreener.com) Aura FAT Projects Acquisition Corp Announces Charter and Trust Agreement Amendments and Extension of Deadline to Complete a Business Combination Singapore - July 16, 2024 - Aura FAT Projects Acquisition Corp , a Cayman Islands exempted company limited by shares, with company registration number , announced today...https://www.marketscreener.com/quote/stock/AURA-FAT-PROJECTS-ACQUISI-139044790/news/Aura-FAT-Projects-Acquisition-Announces-Charter-and-TrustAgreement-Amendments-and-Extension-of-Dea-47394623/?utm_medium=RSS&utm_content=20240716",positive,
1442,Small business sales growth slowed in June as consumers took a pause on spending.,negative,
1443,"MISSION, British Columbia, July 16, 2024 (GLOBE NEWSWIRE) &#8212; Today, Vancouver, B.C., developer Cedar Coast and Langley, B.C. builder Orion Construction broke ground on the Cade Barr Business Park in Mission, B.C. Spanning over 400,000 square feet and accounting for four buildings, the business park marks Cedar Coast’s first development project in the City of [&#8230;]",positive,
1444,Mary Barra and Ginny Rometty discuss being female role models in business with CNBC's Leslie Picker at the inaugural CNBC CEO Council: Leaders' Library.,neutral,
1445,"(marketscreener.com) CHARLOTTE,&nbsp;N.C., July 16, 2024 /PRNewswire/ -- The Board of Directors of Albemarle Corporation announces that it has declared a quarterly common stock dividend of $0.405 per share. The dividend, which has an annualized rate of $1.62, is payable Oct. 1, 2024, to shareholders of record at the close of business as of Sept. 13, 2024. For 30...https://www.marketscreener.com/quote/stock/ALBEMARLE-CORPORATION-11613/news/Albemarle-Announces-Quarterly-Common-Stock-Dividend-47394546/?utm_medium=RSS&utm_content=20240716",negative,
1446,"(marketscreener.com) ALBUQUERQUE,&nbsp;N.M., July 16, 2024 /PRNewswire/ -- At its regular meeting held today, the Board of Directors of&nbsp;PNM Resources declared the regular quarterly dividend of $0.3875 per share on the company's common stock. The dividend is payable August 9, 2024, to shareholders of record at the close of business July 26, 2024. ...https://www.marketscreener.com/quote/stock/PNM-RESOURCES-INC-14072/news/PNM-Resources-Board-Declares-Quarterly-Common-Stock-Dividend-47394543/?utm_medium=RSS&utm_content=20240716",negative,
1447,"Centaurus Energy Announces 2:1 Share ConsolidationCentaurus Energy Announces Shareholders' MeetingCalgary, Alberta--(Newsfile Corp. - July 16, 2024) - Centaurus Energy Inc. (TSXV: CTA) (OTC Pink: ...",negative,
1448,"If epidemiologists were held accountable for the high costs, drug shortages, and food and chemical misinformation they cause, nonsense like claiming a type 2 diabetes drug that is popular off-label for weight loss in rich people also prevent dementia would stop.Yet the reason so many ""studies"" by epidemiologists are being pushed onto the public now is because it is a fad. Fads, creating them or capitalizing on them, is big business for lawyers on one side and corporations on the other, and epidemiologists capitalize on that.read more",positive,
1449,"(marketscreener.com) Centaurus Energy Inc. announces that the TSX Venture Exchange has issued a temporary trading halt as a normal course of action in connection with the proposed change of business of the Company from a Tier 2 Oil &#38; Gas Issuer to a Tier 2 Investment Issuer , pursuant to TSX-V Policy 5.2 - Changes of Business and Reverse Takeovers . Trading in...https://www.marketscreener.com/quote/stock/CENTAURUS-ENERGY-INC-13870199/news/Centaurus-Energy-Announces-Plans-to-Focus-on-Investing-Directly-in-Physical-and-Digital-Commodities-47394440/?utm_medium=RSS&utm_content=20240716",positive,
1450,"(marketscreener.com) Frontier Communications Parent, Inc. :What we did:&nbsp;Frontier expands access to more than 1 million homes and businesses across the state of Connecticut.&nbsp;Why it matters:&nbsp;According to the latest Connecticut Broadband Report, there is an increasing demand for data and higher adoption of speeds across the state. The people of...https://www.marketscreener.com/quote/stock/FRONTIER-COMMUNICATIONS-P-122323793/news/Frontier-Expands-High-Speed-Fiber-Internet-to-1-Million-Homes-and-Businesses-in-Connecticut-47394430/?utm_medium=RSS&utm_content=20240716",positive,
1451,"(marketscreener.com) PITTSBURGH, July 16, 2024 /PRNewswire/ -- EQT Corporation today announced that its Board of Directors declared a quarterly cash dividend of $0.1575 per share, payable on September 1, 2024, to shareholders of record at the close of business on August 7, 2024. ...https://www.marketscreener.com/quote/stock/EQT-CORPORATION-12492/news/EQT-Declares-Quarterly-Cash-Dividend-47394417/?utm_medium=RSS&utm_content=20240716",neutral,
1452,"(marketscreener.com) Today Avangrid, Inc. announced that its Board of Directors declared a quarterly dividend of $0.44 per share on its Common Stock. This dividend is payable October 1, 2024 to shareholders of record at the close of business on September 2, 2024.About Avangrid: Avangrid, Inc. aspires to be the leading sustainable energy company in the United...https://www.marketscreener.com/quote/stock/AVANGRID-INC-25531436/news/Avangrid-Declares-Quarterly-Dividend-47394410/?utm_medium=RSS&utm_content=20240716",negative,
1453,"""In terms of what parts of the company are hiring, it's pretty broad,"" Craig Trudell, Bloomberg’s Global Autos Editor, told Bloomberg Intelligence. ""Service is a big aspect, especially as the summer season is busy for Tesla with more people driving for vacations and needing service.""",positive,
1454,"It&#8217;s summertime, and the bargains seem easy at a time when many consumer prices are high. July sales events have become aThe post Amazon Prime Day deals are almost here. Should you take advantage of them? appeared first on The Business Journal.",positive,
1455,"Vermont&#8217;s governor on Tuesday urged residents to report any damage from last week&#8217;s flooding to the state, even if theyThe post Vermont governor urges residents to report flood damage to the state for FEMA determination appeared first on The Business Journal.",positive,
1456,"U.S. Sen. Bob Menendez was convicted on Tuesday on all counts at his corruption trial, including accepting bribes of gold andThe post Sen. Bob Menendez guilty of taking bribes in cash and gold and acting as Egypt&#8217;s foreign agent appeared first on The Business Journal.",negative,
1457,"TORONTO, ONTARIO, July 16, 2024 (GLOBE NEWSWIRE) &#8212; Aeterna Zentaris Inc. (NASDAQ: AEZS) (TSX: AEZS) (&#8220;Aeterna&#8221; or the &#8220;Company&#8221;), a specialty biopharmaceutical company developing and commercializing a diversified portfolio of pharmaceutical and diagnostic products and active ingredients for healthcare and cosmetics industries, today announced the voting results on the items of business considered at the [&#8230;]",positive,
1458,"Arrests for illegally crossing the border from Mexico plunged 29% in June, the lowest month of Joe Biden&#8217;s presidency, accordingThe post Border arrests plunge 29% in June to the lowest of Biden&#8217;s presidency as asylum halt takes hold appeared first on The Business Journal.",negative,
1459,British regulators opened a preliminary investigation on Tuesday into Microsoft&#8217;s hiring of an AI startup&#8217;s key staff over concerns thatThe post Microsoft faces UK competition investigation over hiring of AI startup&#8217;s founder and key staff appeared first on The Business Journal.,positive,
1460,"Peter Buxtun, the whistleblower who revealed that the U.S. government allowed hundreds of Black men in rural Alabama to goThe post Tuskegee syphilis study whistleblower Peter Buxtun has died at age 86 appeared first on The Business Journal.",positive,
1461,"(marketscreener.com) Today Domo announced that GNW Consulting, a strategic marketing operations agency that guides companies through implementation, integration and optimization of marketing technology, has partnered with the company to support mutual clients at all stages of their marketing journey, starting from strategy up through deployment. Having helped over...https://www.marketscreener.com/quote/stock/DOMO-INC-44420354/news/GNW-Consulting-and-Domo-Power-Marketing-Operations-Programs-that-Accelerate-Business-Results-47394357/?utm_medium=RSS&utm_content=20240716",neutral,
1462,"(marketscreener.com) NEW YORK, July 16, 2024 /PRNewswire/ -- Squarespace, Inc. , the design-driven platform helping entrepreneurs build brands and businesses online, will report its financial results for the second quarter ended June 30, 2024, before market open on Friday, August 2, 2024. ...https://www.marketscreener.com/quote/stock/SQUARESPACE-INC-122801429/news/Squarespace-to-Announce-Second-Quarter-2024-Financial-Results-on-August-2-2024-47394355/?utm_medium=RSS&utm_content=20240716",positive,
1463,"(marketscreener.com) Allurion Technologies, Inc. , a company dedicated to ending obesity, today announced that it will report financial results for the second quarter 2024 on Tuesday, August 13, 2024. Company management will host a conference call to discuss financial results and provide a business update on the same day at 8:30 AM ET.To access the conference...https://www.marketscreener.com/quote/stock/ALLURION-TECHNOLOGIES-INC-157699317/news/Allurion-to-Report-Second-Quarter-2024-Financial-Results-on-August-13-2024-47394354/?utm_medium=RSS&utm_content=20240716",neutral,
1464,"(marketscreener.com) SAN FRANCISCO, July 16, 2024 -- Upwork Inc. , the world&rsquo;s largest work marketplace that connects businesses with independent talent from across the globe, today announced that it will report its financial results for the second quarter of 2024 on Wednesday, August 7, 2024 after market close. The company will host a Q&amp;A conference call...https://www.marketscreener.com/quote/stock/UPWORK-INC-46415520/news/Upwork-to-Report-Second-Quarter-Financial-Results-on-August-7-2024-47394319/?utm_medium=RSS&utm_content=20240716",neutral,
1465,"(marketscreener.com) Primerica, Inc. announced today that after carefully considering various options, the Board of Directors has opted to exit its senior health business by relinquishing ownership of e-TeleQuote Insurance, Inc. . The senior health subsidiary, acquired in July 2021, does not have a clear path toward anticipated profitability within an acceptable...https://www.marketscreener.com/quote/stock/PRIMERICA-INC-6096652/news/Primerica-Announces-its-Intention-to-Exit-Senior-Health-Business-47394317/?utm_medium=RSS&utm_content=20240716",positive,
1466,"(marketscreener.com) Primerica Announces its Intention to Exit Senior Health Business Duluth, GA, Jul. 16, 2024 - Primerica, Inc. announced today that after carefully considering various options, the Board of Directors has opted to exit its senior health business by relinquishing ownership of e-TeleQuote Insurance, Inc. . The senior health...https://www.marketscreener.com/quote/stock/PRIMERICA-INC-6096652/news/Primerica-Announces-its-Intention-to-Exit-Senior-Health-Business-Form-8-K-47394313/?utm_medium=RSS&utm_content=20240716",negative,
1467,"Delta Air Lines CEO Ed Bastian had stark words for competing airlines that depend on selling low-priced tickets to stay alive. From a report: ""You cannot, if you are on the lower end of the industry's food chain, continue to post losses, particularly given the health of the demand set we've seen over these last couple of years,"" Bastian said as Delta reported disappointing second-quarter financials and warned things could get even worse. Airlines that can't break even ""will not be given the opportunity to continue to run business models they have,"" he added. Bastian's comments came in response...",negative,
1468,The unhinged moneymen of Silicon Valley are all in on MAGA. Offended? They say it's strictly business.,neutral,
1469,"Geoffrey Palermo, 60, pleaded guilty in March to charges of wire fraud, conspiracy to commit wire fraud, making a false statement to a bank, and willfully failing to collect taxes.",negative,
1470,"Associated Press NEW YORK (AP) — Guo Wengui, a self-exiled Chinese business tycoon whose criticism of the Communist Party won him legions of online followers and powerful friends in the American conservative movement, was convicted by a U.S. jury Tuesday of engaging in a massive multiyear fraud that ripped off some of his most devotedThe post Self-exiled Chinese billionaire Guo Wengui convicted of defrauding followers after fleeing to US appeared first on KYMA.",positive,
1471,A small chocolatier in Hummelstown has won the inaugural Grand Confection Award from Retail Confectioners International.  The post Hummelstown chocolatier earns inaugural award with caramel creation appeared first on Central Penn Business Journal.,positive,
