,Description,Sentiment,Subject
2135,"Penny Davidi Borsuk, the director of culinary at Madix's sandwich shop, is suing her and Katie Maloney for failing to uphold their business agreement.",neutral,
2136,"In the bustling heart of Puerto Banus lies a hidden gem, Mr. Cash Pawn Shop. Established 14 years ago, this family-run business has become synonymous with trust and exceptional customer service. Led by the dedicated Ayelen, Mr. Cash ensures that every client receives the attention and respect they deserve, making it a standout in the [&#8230;]",positive,
2137,"By&nbsp;Caleb Fotheringham, RNZ Pacific JournalistWellington, NEW ZEALAND — New Zealand's Deputy Prime Minister, Winston Peters, says mining is critical to transition away from fossil fuels, but the call for a moratorium in international waters by the previous government still stands.Peters, who is also the foreign affairs minister, made the comments after visiting Nauru - a nation pushing alongside mining business, The Metals Company, for deep seabed mining in the high seas.""If you want batteries, if you want to change the economy, then you are not going to get that by just dreaming about it...",positive,
2138,"The founder and owner of the iconic West Virginia chain Gino’s Pizza and Spaghetti House has died. William “Kenney” Grant was 94. That is according to his obituary. He died Wednesday. A native of Huntington, Grant founded Gino’s in 1961. He gradually expanded the business, which currently has around 40 locations around West Virginia. Grant also owned several locations of another West Virginia staple, Tudors Biscuit World. Grant’s family said he remained committed to supporting the Huntington community throughout his life, including the Marshall Artist Series, the arts and...",positive,
2139,"(marketscreener.com) ICE Futures U.S. 18 July 2024 MARGIN UPDATE FOR ICE FUTURES U.S. AGRICULTURAL/FINANCIAL/INDEX PRODUCTS LISTED BELOW: The Exchange is changing the margin requirements for the contracts listed below effective at the close of business Friday, July 19, 2024: ...https://www.marketscreener.com/quote/stock/INTERCONTINENTAL-EXCHANGE-14931198/news/Intercontinental-Exchange-Margin-Update-for-ICE-Futures-U-S-Agricultural-Financial-Index-Products-47415724/?utm_medium=RSS&utm_content=20240718",positive,
2140,A national pitch competition for U.S. small businesses has been launched by SCORE.The post National pitch competition for U.S. small businesses launched by SCORE appeared first on Central Penn Business Journal.,negative,
2141,"Jonathan Adams, the managing editor of the Houston Business Journal, has left to become deputy editor of Professional Products Association International. He had also been the associate editor of the American City Business Journals publication. Prior to joining the Business Journal, Adams worked at the regional design center at Lee Enterprises as a page designer. [&#8230;]",positive,
2142,"Priscilla Presley's suing several former business associates ... claiming she's been the victim of financial elder abuse. TMZ has obtained legal documents, filed by Priscilla Presley's lawyer Marty Singer Thursday, claiming a woman named Brigitte&hellip;",positive,
2143,"(marketscreener.com) U.S. President Joe Biden is continuing to conduct official business while experiencing mild upper respiratory symptoms associated with his COVID diagnosis, his doctor said on Thursday, adding that the president's vital signs remain normal. Biden is continuing treatment with Paxlovid, Dr. Kevin O'Connor wrote in a letter released...https://www.marketscreener.com/news/latest/Biden-continues-to-work-amid-mild-COVID-symptoms-his-doctor-says--47415688/?utm_medium=RSS&utm_content=20240718",positive,
2144,Some 3.3 million steam cleaners are being recalled across North America due to a burn hazard that has resulted in consumers reporting more than 150 injuries. Select models of Bissell-branded &ldquo;Steam Shot Handheld Steam Cleaners&rdquo; can spew hot water or steam while the products are in use or...,positive,
2145,"Being a musician can be a lonely business. Want even a wisp of a prayer of making it into one of the world’s professional classical orchestras? Be prepared to spend five hours or more a day—from the time you’re around 12 or so—by your lonesome, obsessively memorizing the treacherous fingering of Liszt’s “Mephisto Waltz No. [&#8230;]The post The keys of life appeared first on Chicago Reader.",positive,
2146,The National Association of Realtors reported that foreign buyers purchased $42 billion worth of U.S. existing homes from April 2023The post Realtor report: Foreign home buying falls 21% in US appeared first on The Business Journal.,positive,
2147,Many Canadian investors and businesses have shifted their thinking of how to handle their domestic equity interests in businesses and real estate. The pivot is toward viewing those investments as longer-term holdings and less as being disposable positions that may be sold to get the capital needed t...,positive,
2148,A motorist who diced with death by driving on the wrong side of a busy motorway - sparking a police chase - has been jailed.,negative,
2149,Penn State Health CEO Steve Massini announced he will retire Oct. 1. Massini has been the CEO of Penn State Health since 2019 and is the first Penn State alum to lead the university’s health system. “I am incredibly grateful and blessed to have had the opportunity to serve Penn State Health and Penn State [&#8230;]The post Penn State Health CEO Steve Massini to retire appeared first on Central Penn Business Journal.,positive,
2150,"C'è un business simulator, un horror e un metroidvania. E sono tutti gratis.",neutral,
2151,"HUNTINGTON, W.Va. (AP) — The founder and owner of the iconic West Virginia chain Gino’s Pizza and Spaghetti House has died. William “Kenney” Grant was 94. That is according to his obituary. He died Wednesday. A native of Huntington, Grant founded Gino’s in 1961. He gradually expanded the business, which currently has around 40 locationsThe post Kenney Grant, founder of iconic West Virginia pizza chain Gino&#8217;s, dies appeared first on KVIA.",positive,
2152,"HUNTINGTON, W.Va. (AP) — The founder and owner of the iconic West Virginia chain Gino’s Pizza and Spaghetti House has died. William “Kenney” Grant was 94. That is according to his obituary. He died Wednesday. A native of Huntington, Grant founded Gino’s in 1961. He gradually expanded the business, which currently has around 40 locations",positive,
2153,Business owners and leaders near and far are welcoming changes to one of the state’s most controversial business laws. OnThe post PAGA lawsuit relief welcomed locally appeared first on The Business Journal.,positive,
2154,"CM Punk and AEW have mostly been at loggerheads during their brief pathcross. It involved stretching issues with the Young Bucks to engaging in a backstage scuffle with Jack Perry during All In 2023. That ultimately led to a merciful end of his tumultuous career at Tony Khan&#8217;s business, leaving him open for a WWE [&#8230;]The post CM Punk Buries AEW in Front of NXT ‘Daughters’, Say Fans Ahead of Likely SummerSlam Return appeared first on EssentiallySports.",positive,
2155,The UFC chief and the ex-president have grown ever closer since their first business deal in 2001.,positive,
2156,"It’s official. Retailers in Pennsylvania that are currently licensed to sell beer and wine, will soon be able to sell ready-to-drink cocktails. The post Gov. Shapiro signs bill allowing for expanded ready-to-drink cocktail sales appeared first on Central Penn Business Journal.",positive,
2157,"When a man obsessed with woodblocks began to do business with a man obsessed with medical antiques, their relationship flowered — until it soured.",negative,
2158,"Anticipating more business, Indian IT industry is hiring more associates in the first quarter of FY25",positive,
2159,"Strong growth in monthly recurring revenue (MRR): up 30.2% as of June 30, 2024 Further increase in the recurring business share of turnover: 71,6% in H1 2024 compared to 58,8% in H1 2023 First hal...",positive,
2160,"Changes are coming for the White Sox as the July 30 trade deadline draws near. And while the team with baseball’s worst record was getting a sorely needed All-Star break reprieve, general manager Chris Getz was busy shuffling the roster.A flurry of moves, including the somewhat surprising but not unwarranted farewell to struggling 37-year-old catcher Martin Maldonado who was designated for assignment Wednesday, set the tone. Triple-A Charlotte catcher Chuckie Robinson, 29, will be recalled Friday to back up Korey Lee, one of the bright spots of the first half (his .167/.200/.302 batting line...",positive,
2161,"(marketscreener.com) Strong growth in monthly recurring revenue : up 30.2% as of June 30, 2024 Further increase in the recurring business share of turnover: 71,6% in H1 2024 compared to 58,8% in H1 2023 First half turnover:&nbsp;&euro;15.1 million Development of the active contract portfolio: 3,099 contracts as of June 30, 2024 Financial targets confirmed:...https://www.marketscreener.com/quote/stock/WALLIX-GROUP-22497377/news/Wallix-Group-Sustained-hypergrowth-in-recurring-business-in-H1-2024-47415382/?utm_medium=RSS&utm_content=20240718",positive,
2162,(marketscreener.com) Sustained hypergrowth in recurring business in H1 2024 18 Jul 2024 18:45 CEST Subscribe Issuer WALLIX GROUP Strong growth in monthly recurring revenue : up...https://www.marketscreener.com/quote/stock/WALLIX-GROUP-22497377/news/Wallix-Sustained-hypergrowth-in-recurring-business-in-H1-2024-47415381/?utm_medium=RSS&utm_content=20240718,positive,
2163,"The ""Finland Embedded Finance Business and Investment Opportunities Databook 75+ KPIs on Embedded Lending, Insurance, Payment, and Wealth Segments Q1 2024 Update"" report has been added to Research...",neutral,
2164,"A new survey shows that nearly a third of Illinois small businesses couldn&#8217;t pay their rent on time or in full in June, but conditions have improved. The small business network Alignable survey shows that nationwide, 46%",negative,
2165,"(marketscreener.com) Company No. 03477519 OCTOPUS AIM VCT PLC Resolutions passed, other than those as ordinary business, at the Annual General Meeting of Octopus AIM VCT plc held on 18 July 2024 at 33 Holborn, London, EC1N 2HT. Special Business Resolution 10 ...https://www.marketscreener.com/quote/stock/OCTOPUS-AIM-VCT-PLC-4004604/news/Octopus-AIM-VCT-Resolutions-passed-at-AGM-47415200/?utm_medium=RSS&utm_content=20240718",positive,
2166,"NAPLES, FL / ACCESSWIRE / July 18, 2024 / STEMTECH CORPORATION, (OTC Pink:STEK)As CEO of the Company, I want to publicly address the recent issues which delayed our annual ""10K"" and ""10Q"" filings w...",neutral,
2167,"(marketscreener.com) The Board of Directors of L3Harris Technologies has declared a quarterly cash dividend of $1.16 per common share, payable Sept. 20, 2024, to shareholders of record as of the close of business on Sept. 6, 2024.About L3Harris TechnologiesL3Harris Technologies is the Trusted Disruptor in the defense industry. With customers&rsquo;...https://www.marketscreener.com/quote/stock/L3HARRIS-TECHNOLOGIES-INC-60951433/news/L3Harris-Announces-Quarterly-Dividend-47415024/?utm_medium=RSS&utm_content=20240718",negative,
2168,"Gabriel Ruiz De Chavez, 46, of Fresno, pled guilty Wednesday to a single count of wire fraud for stealing moreThe post Fresno man pleads guilty in $1.5M employer embezzlement appeared first on The Business Journal.",negative,
2169,"(marketscreener.com) What to watch - summary Business insolvencies: Up 10% in 2024. As of mid-2024, most countries have been reporting a continuous upside trend in business insolvencies, supporting our forecast for a noticeable increase in half of the countries globally. Two out of...https://www.marketscreener.com/quote/stock/ALLIANZ-SE-436843/news/Allianz-What-to-watch-47415003/?utm_medium=RSS&utm_content=20240718",positive,
2170,"MBW's World’s Greatest Producers series interviews super-producer James Ford about working with Arctic Monkeys, Blur and moreSource",positive,
2171,"(marketscreener.com) ATLANTA, July 17, 2024 - JLL Capital Markets announced today that it closed on the sale and financing of 120 Interstate NW, a four-building light industrial business park in Atlanta, Georgia. JLL represented the seller, Albany Road Real Estate Partners, while Adler Real Estate Partners acquired the property....https://www.marketscreener.com/quote/stock/JONES-LANG-LASALLE-INCORP-13180/news/Jones-Lang-LaSalle-Incorporated-Sale-and-financing-secured-for-120-Interstate-NW-in-Atlanta-47414975/?utm_medium=RSS&utm_content=20240718",positive,
2172,"KAISERAUGST, Switzerland and MAASTRICHT, Netherlands, July 18, 2024 /PRNewswire/ -- dsm-firmenich, innovators in nutrition, health, and beauty, today announces the sale of its MEG-3® fish oil busi...",neutral,
2173,"The ""Denmark Prepaid Card and Digital Wallet Business and Investment Opportunities Databook Market Size and Forecast, Consumer Attitude Behaviour, Retail Spend Q1 2024 Update"" report has been adde...",neutral,
2174,"UNILEVER Philippines is planning to expand its food product portfolio to support the evolving needs of its customers in the Philippines, a company official said. The company plans to bring some of its products, available in other markets, to the Philippines, Unilever Philippines Nutrition Business Unit Lead Marinel M. Villanueva said on the sidelines of [&#8230;]",positive,
2175,"Ariana Madix can't catch a break ... she's been sued for the 2nd time this week, TMZ has learned. In new legal docs obtained by TMZ ... the ""Vanderpump Rules"" star and her costar Katie Maloney are accused of reneging on a business agreement&hellip;",positive,
2176,"One by one, diversity, equity and inclusion initiatives continue to be scaled back by the American corporate world. And Microsoft appears to be one of the latest businesses to join the trend. According to a report, a team leader for the tech company ripped into the program following the recent lay-off of an internal team [&#8230;]",positive,
2177,"(marketscreener.com) Aix-en-Provence, 18 July 2024 HIGHCO: BUSINESS DECLINE IN Q2 2024 ; STABLE&nbsp;ESTIMATED HALF-YEAR EARNINGS; 2024 GUIDANCE REITERATED Business decline in Q2 2024 in line with expectations Q2 2024 gross profit1 of &euro;18.84&nbsp;m, down 1.6% LFL2.H1 2024 gross profit1 of &euro;37.7&nbsp;m, down slightly by 0.6% LFL2.Decline in businesses...https://www.marketscreener.com/quote/stock/HIGHCO-5002/news/HighCo-Q2-2024-Gross-Profit-47414860/?utm_medium=RSS&utm_content=20240718",negative,
2178,"The ""Finland Prepaid Card and Digital Wallet Business and Investment Opportunities Databook Market Size and Forecast, Consumer Attitude Behaviour, Retail Spend Q1 2024 Update"" report has been adde...",neutral,
2179,"Acronis has announced it’s restoring the trusted True Image brand to its backup and drive imaging tool for home users. The program had previously been renamed Acronis Cyber Protect Home Office to fit in with the company’s business-related products (as well as highlight the addition of antimalware protection), but the Swiss company has apparently bowed to popular opinion by restoring the name: Acronis True Image. The new release isn’t purely a rebranding exercise -- Build 41393 adds disk drivers to the bootable WinPE and Linux rescue media, plus offers the usual vague (and undefined...",positive,
2180,"(marketscreener.com) directly or indirectly- with the individual's duty to the Company or adversely affects the individual's judgment in the discharge of his or her responsibilities to or at the Company. A conflict situation can arise when an employee, officer or director takes actions or has interests that may make it difficult to perform his or her work for the...https://www.marketscreener.com/quote/stock/COMMUNITY-FINANCIAL-SYSTE-11995/news/Community-Financial-System-Code-of-Business-Conduct-and-Ethics-47414740/?utm_medium=RSS&utm_content=20240718",negative,
2181,"For history enthusiasts, antique collectors and anyone else who simply wants a piece of bygone eras, 23rd Street Antique Mall is the place to be.",positive,
2182,"(marketscreener.com) Paris, 18 July 2024ROCHE BOBOIS SA the global benchmark in high-end home furnishings and French Art de Vivre, reported H1 2024 revenue of&nbsp;&euro;204.4m, down -7.8%, in line with what had been announced1, with an improvement in Q2 compared with Q1 .In H1 2024, business at the Group&#39;s directly-operated stores held up well, with...https://www.marketscreener.com/quote/stock/ROCHE-BOBOIS-S-A-44531649/news/Roche-Bobois-S-a-H1-2024-REVENUE-EUR-204-4m-RETAIL-SALES-OF-DIRECTLY-OPERATED-STORES-EQUAL-47414701/?utm_medium=RSS&utm_content=20240718",negative,
2183,"The L.A.-based fashion designer and business woman talks to WWD about her pivot to home with her luxury design brand Dumae, which made its foray into the lighting segment.",neutral,
2184,"It&#8217;s a myth that all F1 racers come from ultra-rich families that funded their rise to stardom. While Lando Norris&#8216; father does have a booming business that has made him one of the richest men in Britain, Esteban Ocon hails from a very humble background. The Frenchman started his racing career by taking up karting [&#8230;]The post Alpine’s Priceless Gift Makes Esteban Ocon’s Career Come Full Circle Before Major Haas Announcement appeared first on EssentiallySports.",positive,
2185,"QINGDAO, China, July 18, 2024 /PRNewswire/ -- On 18thJuly 2024, Haier Smart Home entered into the transaction with Electrolux Group in Sweden to acquire 100% equity interest in Electrolux South Africa Proprietary Limited (""ESA""), its subsidiary engaging in water heater business in South Africa, for an enterprise value of ZAR 2.45bn (approx. RMB 98...",positive,
2186,"The trend has become so common that it’s a liability to the business, as well as honest Uber Eats drivers who are “just trying their best to make ends meet”, the worker added.",positive,
2187,"Investment banking is a critical pillar of the global financial system, providing a wide array of services that help businesses grow, restructure, and thrive in competitive markets. This article delves into the various services offered by investment banks and explains how these services contribute to the success and growth of businesses.  What is Investment Banking? [&#8230;]The post Investment Banking Services: How They Help Businesses Thrive appeared first on ABC Money.",positive,
2188,Stars of Skegness have the opportunity to shine once more following the launch of the annual business awards.,positive,
2189,"Check out the honorees of the industry's only peer-nominated award program brought to you by Security Business magazine, SecurityInfoWatch.com and Security Technology Executive magazine",neutral,
2190,"Avantax Advisory Services Inc. bought a new stake in Fidelity Small-Mid Multifactor ETF (NYSEARCA:FSMD &#8211; Free Report) during the first quarter, HoldingsChannel.com reports. The institutional investor bought 41,072 shares of the company&#8217;s stock, valued at approximately $1,596,000. Several other institutional investors and hedge funds also recently made changes to their positions in the business. Sound [&#8230;]",positive,
2191,"Impinj, Inc. (NASDAQ:PI &#8211; Get Free Report) CRO Jeffrey Dossett sold 475 shares of the business&#8217;s stock in a transaction that occurred on Monday, July 15th. The shares were sold at an average price of $175.38, for a total value of $83,305.50. Following the completion of the transaction, the executive now directly owns 63,642 shares [&#8230;]",positive,
2193,"(marketscreener.com) Canadian Prime Minister Justin Trudeau met with a former Bank of Canada Governor last week about eventually joining his Liberal government, days after the Liberal leader reassured Finance Minister Chrystia Freeland that her job was safe, a newspaper reported on Thursday. After Trudeau's Liberals were upset in a by-election last...https://www.marketscreener.com/business-leaders/Mark-Carney-34605/news/Trudeau-talked-with-former-bank-governor-about-joining-government-newspaper-says--47414575/?utm_medium=RSS&utm_content=20240718",positive,
2194,"Warner Bros. Discovery, the parent company of CNN and HBO, is reportedly weighing a plan to split its digital streaming and studio businesses from its legacy television networks in order to boost its sinking share price &#8212; just two years after the mega-merger. WBD boss David Zaslav &#8212; who announced another round of layoffs this...",negative,
2195,"According to a new market research report by Meticulous Research®, the satellite IoT market is projected to reach $2.48 billion by 2031, at a CAGR of 18.2% from 2024 to 2031. Satellite IoT services are used for satellite communication networks to connect terrestrial IoT sensors and IoT end nodes to a server. Satellite IoT communication ...The post Satellite IoT Market to be Worth $2.48 Billion by 2031 appeared first on IoT Business News.",positive,
2196,"The 908th Airlift Wing Head Chaplain, Lt. Col. Bitrus Cobongs, has had an extremely busy past eight months, lending his expertise and leveraging his life experiences and connections to help other team Maxwell members working key projects that can benefit U.S. Air Force members and other vital nation partners as well.",negative,
2197,"Highest Performances Holdings Inc. (NASDAQ:HPH &#8211; Get Free Report)&#8217;s share price gapped down before the market opened on Tuesday . The stock had previously closed at $6.00, but opened at $5.84. Highest Performances shares last traded at $6.00, with a volume of 765 shares. Highest Performances Price Performance The business has a 50-day moving average [&#8230;]",positive,
2198,(marketscreener.com) EQS-News: PWO AG / Key word: ExpansionPWO Group expands Mexican locations further 18.07.2024 / 17:06 CET/CESTThe issuer is solely responsible for the content of this announcement.PWO Group expands Mexican locations further&nbsp;Carlo Lazzarini : &ldquo;We have acquired a high volume of new business in Mexico...https://www.marketscreener.com/quote/stock/PWO-AG-436501/news/PWO-Group-expands-Mexican-locations-further-47414514/?utm_medium=RSS&utm_content=20240718,positive,
2199,"Avantax Advisory Services Inc. trimmed its position in Paychex, Inc. (NASDAQ:PAYX &#8211; Free Report) by 17.3% in the first quarter, according to its most recent filing with the SEC. The institutional investor owned 13,743 shares of the business services provider&#8217;s stock after selling 2,875 shares during the period. Avantax Advisory Services Inc.&#8217;s holdings in Paychex [&#8230;]",positive,
2200,"The Boston Red Sox last offseason tried to add more power to the lineup, but they lost out to the Los Angeles Dodgers for this All-Star slugger. Teoscar Hernández was the highlight of MLB All-Star weekend when he won the 2024 Home Run Derby in an entertaining clash against Bobby Witt Jr. Hernández has been [&#8230;]",positive,
2201,Image: Blizzard Entertainment The Spiritborn comes with the Diablo 4: Vessel of Hatred expansion on Oct. 8 Continue reading&hellip;,neutral,
2205,The Street Games included fierce stick horse races and other entertainment for families.,negative,
2206,"Tribune OnlineFilmone appoints Ladun Awobokun as Chief Content OfficerFilmone Limited, a leading film production and distribution company in Nigeria, has announced the appointment of Ladun Awobokun as Chief Content Officer. This strategic move underscores the firm’s commitment to enhancing its creative vision and further solidifying its leadership in the entertainment industry. In her former position as General Manager, Ladun Awobokun played a pivotal [&#8230;]Filmone appoints Ladun Awobokun as Chief Content OfficerTribune Online",positive,
2207,"Blizzard Entertainment presenta Juno, la nuova eroina di supporto di Overwatch 2, che potete provare gratuitamente questo weekend.Blizzard ha svelato ufficialmente la nuova eroina di supporto di Overwatch 2, Juno, una vivace guaritrice astronauta che sarà giocabile in una ""prova dell'eroe"" a tempo limitato che avrà inizio domani 19 luglio e durerà fino al 21 luglio, disponibile su tutte le piattaforme di riferimento.Prosegui la lettura",neutral,
2208,Truist Securities lowers Golden Entertainment stock target with Buy rating,positive,
2209,"Professional wrestler Ric Flair entertained fans worldwide for decades with his flashy style and tremendous in-ring work. Flair wrestled matches in every decade from the 1970s to the 2020s, though the bulk of his career as a top star was from the 1970s to the 1990s. Flair&#8217;s in-ring career ended in 2011, except for one Read more...The post Ric Flair outraged he was left off ESPN&#8217;s greatest athletes of 21st century list appeared first on Awful Announcing.",negative,
2210,"The ""Italy Ecommerce Market Opportunities Databook 100+ KPIs on Ecommerce Verticals (Shopping, Travel, Food Service, Media Entertainment, Technology), Market Share by Key Players, Sales Channel An...",neutral,
2211,PENN Entertainment cutting staff at ESPN Bet,negative,
2212,"DJ FOCUS ENTERTAINMENT: 2024/25 first-quarter revenue of EUR34.2m, driven by a solid back-catalogue up sharply by 17% FOCUS ENTERTAINMENT FOCUS ENTERTAINMENT: 2024/25 first-quarter revenue of EUR3...",negative,
2213,Image: Blizzard Entertainment The support hero once known as ‘Space Ranger’ is here in a limited-time trial Continue reading&hellip;,neutral,
