,Description,Sentiment,Subject
0,"ST. GEORGE — Kaitlyn Larson, a first-year teacher at Pine View High School, recently received the Best in State award for a business leadership course. Larson’s students in grades 10-12 had the highest passing rate on the YouScience exam during the spring and fall semesters of 2023. The YouScience exam is similar to final exams [&#8230;]",positive,
1,"Harare, Zimbabwe – Local businesses are grappling with a severe liquidity crunch, which is limiting [...]",neutral,
2,"(marketscreener.com) Billionaire Elon Musk has donated to a super pac working to elect former U.S. President Donald Trump, Bloomberg reported on Friday, citing sources. The report did not indicate how much Musk donated but added it was ""a sizable amount"" given to a group called America PAC. https://www.marketscreener.com/business-leaders/Elon-Musk-1364/news/Musk-donates-to-super-pac-working-to-elect-Trump-Bloomberg-reports--47374715/?utm_medium=RSS&utm_content=20240712",positive,
3,"(marketscreener.com) A U.S. trade regulator on Fridayannounced a suite of actions taking aim at ""unfair and deceptivepractices"" it said are illegally imposed on U.S. franchisees bytheir brand owners, such as requiring new fees not outlined infranchise contracts, or using contract provisions to discouragefranchisees from speaking with regulators. The...https://www.marketscreener.com/quote/stock/MCDONALD-S-CORPORATION-4833/news/US-FTC-issues-warning-to-franchisors-over-unfair-business-practices-47374706/?utm_medium=RSS&utm_content=20240712",negative,
4,"4.5 million households in the U.S. have solar panels on their homes. Most of those customers are happy with it - their electricity bills have just about disappeared, and it's great for the planet. But thousands and thousands of people are really disappointed with what they've been sold. Their panels are more expensive than they should be, and they say it is hard to get someone to come fix them when they break. It turns out this sometimes crummy customer experience is no accident. It ties back to how big, national solar companies built their businesses in the first place. To entice people to...",positive,
5,"(marketscreener.com) Billionaire investor Mario Gabelli'sinvestment firm is seeking more details about the valuation ofNational Amusements assets, the investor told Reuters on Friday,signaling the firm may challenge a landmark entertainmentindustry deal inked this week. Skydance Media and Paramount Global agreed onSunday to merge, in a deal that...https://www.marketscreener.com/business-leaders/Mario-Gabelli-1709/news/Gabelli-asks-Paramount-for-details-on-National-Amusements-valuation--47374649/?utm_medium=RSS&utm_content=20240712",positive,
6,"(marketscreener.com) July 12, 2024 5:08 pm QWI announces that at the close of business on 12 July 2024 the Net Asset Value of QWI's shares was $1.32 per share. Attachments Original Link ...https://www.marketscreener.com/quote/stock/QWI-INVESTMENTS-LIMITED-134402695/news/QWI-INVESTMENTS-QWI-ANNOUNCEMENT-RE-NET-ASSET-VALUE-OF-SHARES-47374602/?utm_medium=RSS&utm_content=20240712",positive,
7,"(marketscreener.com) Rome Resources Ltd. is pleased to announce that, at its special meeting of the holders of common shares held earlier today, Rome Shareholders approved a special resolution authorizing and approving the previously announced arrangement under section 288 of the Business Corporations Act among Rome, Pathfinder Minerals Plc and 1475033 B.C....https://www.marketscreener.com/quote/stock/ROME-RESOURCES-LTD-147174692/news/Rome-Resources-Announces-Shareholder-Approval-of-Arrangement-with-Pathfinder-Minerals-47374600/?utm_medium=RSS&utm_content=20240712",positive,
8,"Business Reporter A POTENTIALLY bruising fight for Gwanda-based gold producer Vubachikwe is brewing after mine owners Forbes & Thompson accused one of the creditors, Fawcett Security Operations, of trying to place the mine under corporate rescue as part of a plot to engineer a hostile takeover by London Stock Exchange-listed Kavango Resources. Fawcett made an [&#8230;]",positive,
9,"With creative strategies and deep industry knowledge, Spynn Publicity has established itself as a standout player in public relations.",positive,
10,"I'll Drink To That: Kirland & Ellis partner flexes dexterity mid business call.Gotta Love Rankings!: Check out this list of amazing small, boutique, and midsize firms.Really Could Use More Details On The Bar: Legal educators show concern over what this means for students.Shaky Memory, Absent Law License: Florida Supreme Court strips former judge of his ability to practice.IMMUNITY! IMMUNITY!: Trump thinks yelling it repeatedly will get rid of his legal troubles.The post Quick Wits & Quicker Reflexes &#8212; See Also appeared first on Above the Law.",positive,
11,POUGHKEEPSIE – The City of Poughkeepsie will be exploring the possibility of creating a Business Improvement District to breathe new life into the downtown retail corridor along Main Street. Mayor Yvonne Flowers and the common council has lent their support toward development of the BID. Funded by a special assessment on property owners in the [&#8230;],positive,
12,"(marketscreener.com) NerdWallet, Inc. , which provides trustworthy financial guidance to consumers and small and mid-sized businesses , today announced that it will release its second quarter 2024 financial results on Wednesday, July 31, 2024, and hold a related conference call to discuss the results at 1:30 p.m. Pacific Time the same day.Investors and other...https://www.marketscreener.com/quote/stock/NERDWALLET-INC-128898691/news/NerdWallet-Announces-Conference-Call-to-Review-2024-Second-Quarter-Financial-Results-47374579/?utm_medium=RSS&utm_content=20240712",negative,
13,"The Baltimore Business Journal has hired Ben Terzi as its research editor. Terzi manages various databases to produce weekly Lists, the Book of Lists and other research projects for the Baltimore Business Journal. Prior to joining the Business Journal, he covered community news for The Dundalk Eagle and Avenue News. Born and raised in Baltimore, Terzi is [&#8230;]",positive,
14,"(marketscreener.com) Why: Rosen Law Firm, a global investor rights law firm, continues to investigate potential securities claims on behalf of shareholders of Arbor Realty Trust, Inc. resulting from allegations that Arbor may have issued materially misleading business information to the investing public.So what: If you purchased Arbor securities you may be...https://www.marketscreener.com/quote/stock/ARBOR-REALTY-TRUST-INC-11503/news/Rosen-Law-Firm-Encourages-Arbor-Realty-Trust-Inc-Investors-to-Inquire-About-Securities-Class-Actio-47374565/?utm_medium=RSS&utm_content=20240712",negative,
15,"Footprints Floors of Solano is currently a one-man operation, but it hasn’t slowed Linda down. The self-proclaimed ‘workaholic’ is his own production manager, salesman and computer guy, but not for long. With business doing well, he says he’ll be able to add to the team in the near future.",positive,
17,"Living in the picturesque Northern Beaches of Sydney, Hannah Miller was no stranger to the exhausting realities of new motherhood. ",negative,
18,byNordic Acquisition announces extension of deadline to complete business combination,positive,
19,"The Government Accountability Office has found that multiple Department of Defense IT business programs actively developing software via Agile and iterative approaches have failed to use metrics and management tools in line with the GAO Agile Assessment Guide and mandated by the DOD. GAO said in a report issued Thursday that it had assessed 10 Defense Department programs involved in software development and found four to be non-compliant, resulting in the risk that the DOD does not possess sound information concerning its Agile software development efforts. To correct the issue, GAO recommended...",positive,
20,"The Department of Defense has selected the first awardee to contribute to the Distributed Bioindustrial Manufacturing Program, a.k.a. DBIMP. Biotechnology company&#160;Debut will be given $2 million to deliver business and technical plans that outline the construction of a U.S.-based bioindustrial manufacturing production facility,&#160;the Pentagon said Wednesday. The facility’s construction would be funded via the&#160;Defense Industrial Base Consortium Other Transaction Agreement. Aprille Ericsson, assistant secretary of defense for science and technology, said this award is a big step...",negative,
21,"(marketscreener.com) New York, NY, July 12, 2024 -- byNordic Acquisition Corporation , a special purpose acquisition company, announced today that the Company has timely deposited into the Company&rsquo;s trust account , an aggregate of $105,000, in order to extend the period of time the Company has to complete a business combination for an additional one month...https://www.marketscreener.com/quote/stock/BYNORDIC-ACQUISITION-CORP-133095241/news/ByNordic-Acquisition-Corporation-Announces-Extension-of-Deadline-to-Complete-Business-Combination-47374469/?utm_medium=RSS&utm_content=20240712",positive,
22,The Greatest Outdoor Show on Earth is flirting with record-breaking attendance numbers as hundreds of thousands of visitors continue to pile into Stampede Park.,positive,
23,"Medical officials in Houston say widespread power outages caused by Hurricane Beryl have flooded area hospitals with patients seeking treatment for heat-related illnesses and carbon monoxide poisoning due to using home generators improperly. The Houston Office of Emergency management said Friday that more than 320 patients suffered from heat-related illnesses, about triple the norm at this time of year. More than 120 cases of carbon monoxide poisoning from improper generator were also reported. Beryl initially knocked out power to about 2.7 million homes and businesses when it came ashore...",positive,
24,"(marketscreener.com) ARLINGTON, Va., July 12, 2024 /PRNewswire/ --&nbsp;The Board of Directors of The AES Corporation declared a quarterly common stock dividend of $0.1725 per share payable on August 15, 2024 to shareholders of record at the close of business on August 1, 2024.&nbsp; ...https://www.marketscreener.com/quote/stock/AES-CORPORATION-THE-11547/news/AES-Announces-Quarterly-Dividend-47374356/?utm_medium=RSS&utm_content=20240712",negative,
25,"https://youtu.be/9TV4Tr-9xFw This Prime Day deal is so good, it just might put your dentist out of business. Take it from The Post’s review – Crest 3D Whitestrips make a difference “after just one use” with “dramatic results” after only two weeks.",positive,
26,"What if the reason for the wealth gap and sea of intractable issues is so common, we can’t see it?The post BLOG: The invisible monster devouring the California dream appeared first on The Business Journal.",negative,
27,"The Global Hotel Alliance network of independent hotels, founded 20 years ago, in recent years has continues to grow, adding properties throughout the world and reaching a new peak in 2023 in bookings under its GHA Discovery loyalty program. GHA CEO Chris Hartley spoke with BTN about the state of the network, business travel trends and the promise of direct booking. &#160;",positive,
28,"~ ConnectM Common Stock to Trade on Nasdaq on July 15, 2024 Under Ticker ""CNTM"" ~ MARLBOROUGH, MA / ACCESSWIRE / July 12, 2024 / ConnectM Technology Solutions, Inc. (""ConnectM""), a technology compa...",negative,
29,Research for Argos by the Centre for Economic and Business Research shows England making it to their second successive Euros final will boost consumer spending by £2.4billion.,positive,
30,"At its July 2 work session, the Southold Town Board discussed potential plans for the Mattituck intersection previously proposed for a Brinkmann Hardware store. The board is mulling ways to make the intersection of Main Road and New Suffolk Avenue safer for pedestrians. Brinkmann Hardware Corp. had planned to build a 20,000-square-foot store at the...The post Board eyes fixes at busy Mattituck intersection appeared first on The Suffolk Times.",positive,
31,"Nobody wants to be bitten by a snake, especially a rattlesnake.Kelowna's Fairfield Animal Hospital say they have treated eight rattlesnake bites for pets this year and are expecting that number to rise with the heat this summer.These bites have been happening across the Okanagan, including P...",positive,
32,Extreme heat can raise the danger of heat-related illnesses and threaten health in a more subtle way — by amplifyingThe post Extreme heat and some medicines can be a risky combo. Here&#8217;s what to know appeared first on The Business Journal.,positive,
33,(AP) — Wildfires fueled by strong winds and an extended heat wave have led to the first death in CaliforniaThe post California fire officials report first wildfire death of the 2024 season appeared first on The Business Journal.,positive,
34,"Tourism around the world is booming this year, building on several years of recovery from the disruptions of the COVID-19 pandemic. Seoul, of course, is no exception, as any walk through Myeong-dong reveals. Empty two years ago, the area is now full of international tourists and shops are doing a booming business. Other areas of Seoul, such as Bukchon, Hongdae and Seongsu-dong are full of international tourists. Myeong-dong&rsquo;s recovery and the ongoing tourist boom are part of a long-term tr",positive,
35,"(marketscreener.com) ORRVILLE, Ohio, July 12, 2024 /PRNewswire/ -- The J.M. Smucker Co. today announced its Board of Directors approved an increase in the quarterly dividend from $1.06 to $1.08 per common share, an increase of two percent. The next dividend will be paid on Tuesday, September 3, 2024, to shareholders of record at the close of business on Friday,...https://www.marketscreener.com/quote/stock/THE-JM-SMUCKER-COMPANY-14400/news/The-J-M-Smucker-Co-Announces-Dividend-Increase-47374247/?utm_medium=RSS&utm_content=20240712",negative,
36,"(marketscreener.com) BIRMINGHAM, Ala., July 12, 2024 /PRNewswire/ -- The Board of Directors of Vulcan Materials Company today declared a quarterly cash dividend of $0.46 cents per share on its common stock. The dividend will be payable on September 4, 2024, to shareholders of record at the close of business on August 15, 2024.&nbsp;Vulcan Materials Company, a...https://www.marketscreener.com/quote/stock/VULCAN-MATERIALS-COMPANY-14815/news/VULCAN-DECLARES-QUARTERLY-DIVIDEND-ON-COMMON-STOCK-47374245/?utm_medium=RSS&utm_content=20240712",negative,
37,"In the race to stay ahead in artificial intelligence, the biggest technology companies are swallowing up the talent and productsThe post US senators call out Big Tech&#8217;s new approach to poaching talent, products from smaller AI startups appeared first on The Business Journal.",negative,
38,The data of nearly all customers of the telecommunications giant AT&T was downloaded to a third-party platform in a securityThe post Data of nearly all AT&T customers downloaded to a third-party platform in security breach appeared first on The Business Journal.,positive,
39,(AP) — Signs of consumers slowing down their spending and falling behind on their bills weighed down shares of theThe post Big bank quarterly results show signs of consumers slowing down spending appeared first on The Business Journal.,negative,
40,"Associated Press HOUSTON (AP) — Widespread power outages caused by Hurricane Beryl have sent a wave of patients to Houston-area hospitals for treatment of heat-related illnesses and carbon monoxide poisoning due to using home generators improperly, medical officials said Friday. Hundreds of thousands of homes and businesses have been without power since Beryl swept ashoreThe post Houston hospitals report spike in heat-related illness during widespread storm power outages appeared first on KVIA.",positive,
42,"(marketscreener.com) Austin, Texas, July 12, 2024 -- Acri Capital Acquisition Corporation , a special purpose acquisition company, today announced that, in order to extend the date by which the Company must complete its initial business combination from July 14, 2024 to August 14, 2024, Acri Capital Sponsor LLC, the sponsor of the Company, has deposited into its...https://www.marketscreener.com/quote/stock/ACRI-CAPITAL-ACQUISITION--139248436/news/Acri-Capital-Acquisition-Corporation-Announces-Extension-of-the-Deadline-for-an-Initial-Business-Com-47374172/?utm_medium=RSS&utm_content=20240712",positive,
43,"NEW YORK &#8212; Announcement of Mesabi Trust Distribution The Trustees of Mesabi Trust (NYSE:MSB) declared a distribution of thirty cents ($0.30) per Unit of Beneficial Interest payable on August 20, 2024 to Mesabi Trust Unitholders of record at the close of business on July 30, 2024. This compares to no distribution declared for the same [&#8230;]",positive,
44,"(marketscreener.com) CHARLOTTE, N.C., July 12, 2024 -- Coca-Cola Consolidated, Inc. announced that the Board of Directors has declared a dividend for the third quarter of 2024 of $0.50 per share on shares of the Company's Common Stock and Class B Common Stock payable on August 9, 2024 to shareholders of record as of the close of business on July 26, 2024. ...https://www.marketscreener.com/quote/stock/COCA-COLA-CONSOLIDATED-IN-8857/news/Coca-Cola-Consolidated-Inc-Announces-Third-Quarter-Dividend-47374154/?utm_medium=RSS&utm_content=20240712",negative,
45,"(marketscreener.com) On Friday, July 12, 2024, the Board of Directors of Cabot Corporation declared a quarterly dividend of $0.43 per share on all outstanding shares of the Corporation&rsquo;s common stock. The dividend is payable on September 13, 2024, to stockholders of record at the close of business on August 30, 2024.About Cabot CorporationCabot...https://www.marketscreener.com/quote/stock/CABOT-CORPORATION-11994/news/Cabot-Corporation-Board-Declares-Dividend-47374150/?utm_medium=RSS&utm_content=20240712",positive,
46,"Before DeGeneres said last week that she's going 'bye-bye' from show business, she joked about 'being kicked out of show business for being mean,' a turn events that seemed to start with another comedian's tweet.",negative,
48,"Samsung unveiled new wearable devices at its Unpacked event earlier this week, drawing comparisons to Apple's offerings. The Galaxy Watch Ultra, set for release on July 24, bears striking similarities to Apple's Watch Ultra 2 launched last September. Both feature titanium cases, orange-accented buttons, and specialized bands. Samsung's version, priced at $650, undercuts Apple's $800 model. Business Insider adds: But the strategy has its downsides. If you spot someone wearing Galaxy Watch Ultra, there's a good chance you'd mistake it for Apple's model -- which doesn't help Samsung differentiate...",positive,
49,"World Business Capital, una empresa líder en desarrollo y negocios con sedes en México y los Estados Unidos, se complace en anunciar el reconocimiento obtenido por sus destacados proyectos en el sureste de México. Estos logros subrayan nuestro compromiso con la excelencia, la innovación y el desarrollo sostenible, así como nuestro compromiso con nuestros inversionistas. [&#8230;]Esta nota Reconocen a World Business Capital por sus proyectos en el sureste de México apareció primero en Diario de Yucatán.",neutral,
50,"Kentucky Gov. Andy Beshear is taking a business trip to Asia to promote the Bluegrass State. The trip comes amid turmoil over whether President Joe Biden should continue with his bid for a second term. Beshear is one of several Democratic governors whose names have been mentioned in speculation about what a replacement ticket might look like. But he's keeping the focus on his job as governor and bringing more jobs to Kentucky. Before leaving, Beshear reiterated his support for Biden “as long as he is our nominee.” He says Biden needs to be forthcoming about his health following his widely...",positive,
51,"By the early 1970s few people were doing anything &#8216;on state street, that great street,&#8217; as Frank Sinatra once crooned. Chicago’s business and civic leaders decided the once thriving retail strip desperately needed resuscitation. They created “People Week” in 1973, a series of special events along State Street and in the many department stores that [&#8230;]",positive,
52,"Every company wants to grow revenue. But how? In this article, CEOs, founders, and top business minds reveal strategic decisions that propelled their companies forward. From focusing on upsells for current clients to launching comprehensive on-page SEO training, here’s fifteen transformative insights that could boost your company revenue. Focus on Current Clients&#8217; Upsells Transition to [&#8230;]The post What Strategic Decisions Can Boost Company Revenue? appeared first on NewsReports.",positive,
53,"Lotte Biologics recently held a groundbreaking ceremony for its inaugural plant at the Songdo Bio Campus in Incheon International City. The ceremony marked a step toward becoming a global top 10 CDMO, Lotte said in a news release. Lotte&#8217;s new campus comes as part of its &#8220;Bio & Wellness&#8221; business focus. It features an investment&#8230;The post Lotte Biologics is spending billions on new Korean plant appeared first on Pharmaceutical Processing World.",positive,
54,"QX Global Group, one of the world&#8217;s fastest-growing business process management companies, has secured a significant investment from Long Ridge Equity Partners. This investment follows a period of exceptional growth at QX and will support further platform development and global expansion. QX carefully selected Long Ridge as the ideal partner to support its next phase [&#8230;]The post QX Global Group Secures Major Growth Investment from Long Ridge Equity Partners appeared first on ABC Money.",positive,
55,"Rebuilding businesses and the local economies in Sulphur and Marietta is slow going after tornadoes tore through the two south central Oklahoma communities on April 27, officials said this week.",negative,
56,“Qatar Airways has a so-called ‘business class lite’ fare which doesn’t allow lounge access or seat selection without significant additional charge.”,positive,
59,"CHICO &#8212; The fresh produce stand at Chico State&#8217;s University Farm did brisk business Friday morning, drawing customers from Butte County and beyond. Casey and Roberta Hemping drove in from Corning to pick, well, corn. The stand had two full bins of sweet corn ears along with one nearly emptied. The Hempings &#8220;came for the corn,&#8221; Casey said, though he also had new glasses waiting for him at Costco. A rotating sign drew Hegan Lane drivers to the stand at the farm&#8217;s main entrance on Hegan and Nicholas C. Shouten Lane. Summer sales began Wednesday, and the student-run...",positive,
60,"CHICO &#8212; The fresh produce stand at Chico State&#8217;s University Farm did brisk business Friday morning, drawing customers from Butte County and beyond. Casey and Roberta Hemping drove in from Corning to pick, well, corn. The stand had two full bins of sweet corn ears along with one nearly emptied. The Hempings &#8220;came for the [&#8230;]",positive,
61,"In the annals of business history, daring and unorthodox strategies often define the trajectory of industry giants. These titans of industry, undeterred by conventional wisdom, have pioneered innovative approaches that have redefined markets, shattered paradigms, and set new benchmarks for success. Here, we explore the essence of these transformative strategies, shedding light on the principles [&#8230;]The post Unorthodox Strategies That Transformed Industry Giants appeared first on Insights Success.",positive,
62,The largest full-spectrum infrared and red-light sauna therapy business in the U.S. is expanding to the metro with two locations.,neutral,
63,"(marketscreener.com) Inspiring Innovation At the Kosmos Innovation Center Mauritania, our signature program is the annual KIC Mauritania Innovation Challenge. Through the Innovation Challenge process, we provide entrepreneurs under 40 and operating early-stage startups with several months of mentorship and business training. At...https://www.marketscreener.com/quote/stock/KOSMOS-ENERGY-LTD-50061050/news/Kosmos-Energy-Seeding-Visionary-Startups-in-Mauritania-47373885/?utm_medium=RSS&utm_content=20240712",positive,
64,"(marketscreener.com) By Dominic Chopping Elon Musk's social-media platform X is in breach of the European Union's online-content law, opening the company up to a large potential fine, according to a preliminary decision from the bloc's executive arm. Friday's decision from the European Commission follows a monthslong investigation into X, formerly known as...https://www.marketscreener.com/business-leaders/Elon-Musk-1364/news/Elon-Musk-s-X-Found-in-Breach-of-EU-Digital-Content-Law-2nd-Update--47373868/?utm_medium=RSS&utm_content=20240712",positive,
65,The attraction closures take place just before the Halloween crowds descend on the Disney parks.,neutral,
74,"Musicians have been battling brands for years over stolen music, artwork, concepts, and more that brands have used for their marketing campaigns. Nowadays, it seems like big businesses can get away with just about anything. That’s what these three major brands thought when they illegally used a musician’s music (or, rather, “sound-alikes”) for promotional purposes. [&#8230;]The post 3 Times That Big Brands Used Songs Illegally and Got Sued for It appeared first on American Songwriter.",negative,
75,"hbo The 'Euphoria' cast is very busy, but they'll find a way to fit in season 3.",positive,
76,WellSpan York Hospital Emergency Department has been recognized by the Emergency Nurses Association for the second time. The post WellSpan York Hospital ED honored for performance appeared first on Central Penn Business Journal.,positive,
