,Description,Sentiment,Subject
639,"FORT LIBERTY, N.C. – In the face of the many dangers, U.S. Army technology has adapted to protect leaders and soldiers on the modern battlefield while propelling the Army into 2030. Leaders like Command Sgt. Maj. Corey Wilkens, command sergeant major, 20th Engineer Brigade, XVIII Airborne Corps, personally witnessed the advancement of technology over the last 22 years, where the brigade’s mission is to provide engineer support to units across the Army, joint and special operation forces.",positive,
640,"Twenty years after Coles introduced self-serve checkouts, Aldi is rolling out the “win-win” technology in hundreds of stores.",neutral,
648,Women urged to embrace new technologies,positive,
649,"TORONTO &#8212; When Cathie Wood scans the global technology sector, one innovation stands out, even as its proliferation creates new opportunities. Artificial intelligence, the U.S. tech investment maven said, is &#8220;the biggest catalyst&#8221; for the innovation she sees taking place across the five major areas funded by her firm, Ark Invest. Those areas of focus [&#8230;]",negative,
651,"The U.S. Army Combat Capabilities Development Command Chemical Biological Center (DEVCOM CBC) hosted their annual Coffee with Colleagues event this past May, where the Center’s experts shared their ongoing projects and scientific findings. The event was intended to give SMEs extra practice in presenting their next-generation technology to future customers and create a setting that facilitates future collaborative efforts. But, this time, CBC was treated to a visit by a group of guests of honor that are seldom seen at such a technical event – our nation’s warfighters.",negative,
652,"Captain Seth Mcgeehan, a JCIDS Team Lead, stops to discuss and learn more on future technologies from DEVCOM CBC SME Allison Clay. (U.S. Army photo by Parker Martin)",positive,
653,"Nanoparticles have a wide variety of applications, from drug delivery to electronics to air purification. Their small size and tunable properties make them particularly valuable for technological advancements and scientific research. When polymers made from nanoparticles are grafted together, the functionality of the materials can be improved.",negative,
654,"(marketscreener.com) Amityville, NY - NAPCO Security Technologies, Inc., based in Amityville, NY, is pleased to announce several key personnel changes within its Napco Access Pro Division sales team . Joining its VP Aaron Black in Sales Management is the newly-promoted Rob Etmans, Director of Sales, succeeding the well-respected icon Scott Schramme,...https://www.marketscreener.com/quote/stock/NAPCO-SECURITY-TECHNOLOGI-10252/news/Napco-Security-Technologies-Exciting-Personnel-Updates-in-the-Napco-Access-Pro-Sales-Division-47373893/?utm_medium=RSS&utm_content=20240712",positive,
655,"A new technology aims to take gene therapies a step further, making it possible for the treatment to be used more widely, at lower cost, and with improved outcomes for patients.",positive,
656,"Der Relative Strength Index (RSI) dient zur Beurteilung, ob ein Wertpapier ""überkauft"" oder ""überverkauft"" ist, indem die Auf- und Abwärtsbewegungen im Zeitverlauf in Relation gesetzt werden. Dieser Indikator aus der technischen Analyse wird häufig im Finanzmarkt verwendet. Für Alkami wird sowohl der kurzfristige RSI der letzten 7 Tage als auch der längerfristige RSI auf 25-Tage-Basis analysiert. [mehr]",neutral,
657,"DAHLGREN, Va. (July 01, 2024) Surface Combat Systems Training Command AEGIS Training and Readiness Center’s Systems Test Officer / Lab Manager, Mr. Greg Kuss, discusses the tactical and technical capabilities of the Technology Insertion (TI) -16 Lab to Reserve Deputy Commander, U.S. Naval Surface Force Atlantic, Rear Adm. Kimberly Walz, during her tour of the schoolhouse located onboard Naval Support Facility Dahlgren, Virginia. (U.S. Navy photo by Michael Bova)",negative,
658,(marketscreener.com) Wins new deals with Total Contract Value of almost $2B in Q1 FY25Dividend of &#8377;12 per share for the quarterhttps://www.marketscreener.com/quote/stock/HCL-TECHNOLOGIES-LIMITED-9058931/news/HCLTech-Delivers-Another-Solid-Quarter-With-Revenue-Growth-of-5-6-YoY-CC-47373819/?utm_medium=RSS&utm_content=20240712,positive,
659,"With all the fierce competition in the hospitality industry, running a restaurant or takeaway now requires more than just excellent food and customer service. Owners must be willing to make the jump to digitalisation.  We recommend opting for an electronic point-of-sale (EPOS) system, a technology that has grown in immense popularity over recent years as [&#8230;]The post Boost Efficiency: The Importance of an EPOS System for Takeaways appeared first on ABC Money.",positive,
660,"Legal professionals are confronted with challenges such as technological barriers, ethical concerns, and evolving legal frameworks and regulations.The post Overcoming Hurdles And Shaping The Future Of Legal Tech In The Age Of Artificial Intelligence appeared first on Above the Law.",positive,
661,"Staff Sgt. Kimberly Glaspie, an information technology specialist with the 3rd Military Police Group, Criminal Investigation Division, shares her Army story during a spiritual resiliency training event July 12, at Hunter Army Airfield. Chap. (Capt.) Jason Andrews, the chaplain for 603rd Aviation Support Battalion, 3rd Combat Aviation Brigade, led the event which focused on relationships and how the spiritual aspect impacts other areas of life. (U.S. Army Photo by Monica K. Guthrie)",negative,
662,"Under the Sagarmala programme, the Ministry of Ports, Shipping, and Waterways (MoPSW) is developing a National Maritime Heritage Complex (NMHC) at Lothal, Gujarat. This world-class facility aims to be an international tourist destination, showcasing India’s maritime heritage from ancient to modern times through an edutainment approach utilizing the latest technology. An onsite project progress review [&#8230;]",positive,
663,"Gen. Duke Z. Richardson, commander, Air Force Materiel Command, addresses a crowd at the Air Force Research Laboratory, or AFRL, Change of Command Ceremony at the National Museum of the United States Air Force, July 10, 2024. Brig. Gen. Jason E. Bartolomei assumed command of AFRL at the ceremony, taking the reins from outgoing commander Maj. Gen. Scott A. Cain, who served since June 2023. Bartolomei holds a PhD in Engineering Systems from the Massachusetts Institute of Technology, as well as a Master’s Certificate in Legislative Studies from Georgetown University. Prior to that, Bartolomei...",neutral,
664,"Gen. Duke Z. Richardson, commander, Air Force Materiel Command, left, and outgoing Air Force Research Laboratory, or AFRL, Commander Maj. Gen. Scott A. Cain, right, applaud as Brig. Gen. Jason E. Bartolomei, middle, is formally announced as AFRL Commander at a change of command ceremony at the National Museum of the United States Air Force in Dayton, Ohio, July 10, 2024. “I have full confidence that Gen. Bartolomei is going to continue to build on our momentum and lead this team through this era of technological competition,” Cain said. (U.S. Air Force photo / Keith Lewis)",positive,
665,"Das Anleger-Sentiment stellt einen wichtigen Stimmungsindikator zur Einschätzung einer Aktie dar. In den letzten Tagen rückte insbesondere die Aktie von Hengxin in den Fokus der Diskussionen in den sozialen Medien. Dabei wurden überwiegend positive Meinungen veröffentlicht, jedoch beschäftigte sich der Meinungsmarkt in den vergangenen Tagen weder intensiv mit positiven noch mit negativen Themen rund um Hengxin. [mehr]",positive,
666,"In der jüngsten Diskussion in sozialen Medien stand die Aktie von Beijing United Information im Rampenlicht, wobei überwiegend positive Meinungen geäußert wurden. Trotz dieser positiven Resonanz war das allgemeine Interesse in den letzten Tagen weder stark auf positive noch auf negative Themen fokussiert. [mehr]",negative,
668,"Diplomats are more crucial than ever as the world becomes increasingly connected. Indonesian diplomats, in particular, bear the significant responsibility of representing and advancing their country on the global stage. To succeed they require an exceptional blend of skills and knowledge: adaptability competence in international relations, economic strategy, technological sophistication and a deep understanding of national interests. This essay explores these qualities and how they enable Indonesian diplomats to thrive in the evolving landscape of modern diplomacy.High Skill and Adaptability...",positive,
669,Scientists have used state of the art 3D imaging technology to piece together the life—and probable death—of a 2.2 meter-long crocodile mummified by the ancient Egyptians.,neutral,
670,"Según estudio de EY,  el 85% de empresarios peruanos considera que la implementación de la analítica será un factor fundamental para sus negocios. &#160; Lima, 12 de julio de 2024.  En el reciente Jueves Minero, Francisco Escudero, Partner Technology Consulting de EY, presentó un estudio donde resaltó las principales tendencias en el Perú, a nivel [&#8230;]La entrada Ejecutivos peruanos afirman que analytics, big data e inteligencia artificial serán claves en sus industrias al 2027 se publicó primero en El portal de los líderes de opinión.",negative,
671,"La Conferencia Internacional de Minería y Recursos-IMARC 2024 es una de las conferencias internacionales de minería y recursos más grandes del mundo. Se realiza en Australia y tiene una participación importante de empresas METS (Mining Equipment, Technology and Services) cuyos servicios son exportados a diferentes partes del mundo. Así lo afirmó la Embajadora de Australia [&#8230;]La entrada Perú y Australia reafirman alianza minera y relaciones comerciales en IMARC 2024 se publicó primero en El portal de los líderes de opinión.",neutral,
672,"A survey of more than 300 North American C-level executives unveils key obstacles and increased financial commitment in diverse sectors, from beauty care to home improvement.",positive,
673,"(marketscreener.com) This article was automatically generated by Dow Jones using technology from Automated Insights. Stocks in the Nordic region increased Friday, with the OMX Nordic 40 Index rising 1.2%. Xvivo Perfusion AB was the biggest leader among large stocks during the session, rocketing 23.8%, and Addtech AB Series B surged 16.0%. Aker...https://www.marketscreener.com/quote/index/OMX-STOCKHOLM-30-INDEX-7399/news/Nordic-Stocks-Moved-Upward-Friday-Xvivo-Perfusion-Climbed-Highest-47373451/?utm_medium=RSS&utm_content=20240712",positive,
674,Consumer technology writer Gareth Butterfield travels with a lot of tech - and the gadget he uses to keep them all powered is currently cheaper than it's ever been,neutral,
678,"Test Flight Engineer Ross Elkort, points at cargo prior to loading onto BETA Technologies prototype ALIA CTOL battery-powered fixed-wing aircraft at Dover Air Force Base, Delaware, July 9, 2024. The aircraft delivered 222 lbs. of cargo which was loaded and shipped from Joint Base McGuire-Dix-Lakehurst, N.J., to Dover AFB. BETA partnered with AFWERX Agility Prime to test the capabilities of moving cargo between bases in a safer, cleaner, and more cost-effective way. (U.S. Air Force photo by Staff Sgt. Marco A. Gomez)",negative,
679,"Cargo is loaded onto BETA Technologies prototype ALIA CTOL battery-powered fixed-wing aircraft prior to takeoff at Dover Air Force Base, Delaware, July 9, 2024. The aircraft delivered 222 lbs. of cargo which was loaded and shipped from Joint Base McGuire-Dix-Lakehurst, N.J., to Dover AFB. BETA partnered with AFWERX Agility Prime to test the capabilities of moving cargo between bases in a safer, cleaner, and more cost-effective way. (U.S. Air Force photo by Staff Sgt. Marco A. Gomez)",negative,
680,"BETA Technologies prototype ALIA CTOL battery-powered fixed-wing aircraft taxis out at Dover Air Force Base, Delaware, July 9, 2024. The aircraft delivered 222 lbs. of cargo which was loaded and shipped from Joint Base McGuire-Dix-Lakehurst, N.J., to Dover AFB. BETA partnered with AFWERX Agility Prime to test the capabilities of moving cargo between bases in a safer, cleaner, and more cost-effective way. (U.S. Air Force photo by Staff Sgt. Marco A. Gomez)",negative,
681,"Test Flight Engineer Ross Elkort, prepares BETA Technologies prototype ALIA CTOL battery-powered fixed-wing aircraft for takeoff at Dover Air Force Base, Delaware, July 9, 2024. The aircraft delivered 222 lbs. of cargo which was loaded and shipped from Joint Base McGuire-Dix-Lakehurst, N.J., to Dover AFB. BETA partnered with AFWERX Agility Prime to test the capabilities of moving cargo between bases in a safer, cleaner, and more cost-effective way. (U.S. Air Force photo by Staff Sgt. Marco A. Gomez)",negative,
682,"Test Flight Engineer Ross Elkort, left, talks with Bedrock Innovation Lab members about the BETA Technologies prototype ALIA CTOL battery-powered fixed-wing aircraft at Dover Air Force Base, Delaware, July 9, 2024. The aircraft delivered 222 lbs. of cargo which was loaded and shipped from Joint Base McGuire-Dix-Lakehurst, N.J., to Dover AFB. BETA partnered with AFWERX Agility Prime to test the capabilities of moving cargo between bases in a safer, cleaner, and more cost-effective way. (U.S. Air Force photo by Staff Sgt. Marco A. Gomez)",negative,
683,"Test Flight Engineer Ross Elkort, left, talks with Transient Alert personnel about the BETA Technologies prototype ALIA CTOL battery-powered fixed-wing aircraft at Dover Air Force Base, Delaware, July 9, 2024. The aircraft delivered 222 lbs. of cargo which was loaded and shipped from Joint Base McGuire-Dix-Lakehurst, N.J., to Dover AFB. BETA partnered with AFWERX Agility Prime to test the capabilities of moving cargo between bases in a safer, cleaner, and more cost-effective way. (U.S. Air Force photo by Staff Sgt. Marco A. Gomez)",negative,
684,"A helmet sits on a seat aboard BETA Technologies prototype ALIA CTOL battery-powered fixed-wing aircraft at Dover Air Force Base, Delaware, July 9, 2024. The aircraft delivered 222 lbs. of cargo which was loaded and shipped from Joint Base McGuire-Dix-Lakehurst, N.J., to Dover AFB. BETA partnered with AFWERX Agility Prime to test the capabilities of moving cargo between bases in a safer, cleaner, and more cost-effective way. (U.S. Air Force photo by Staff Sgt. Marco A. Gomez)",negative,
685,"BETA Technologies prototype ALIA CTOL battery-powered fixed-wing aircraft lands at Dover Air Force Base, Delaware, July 9, 2024. BETA partnered with AFWERX Agility Prime to test the capabilities of moving cargo between bases in a safer, cleaner, and more cost-effective way. (U.S. Air Force photo by Staff Sgt. Marco A. Gomez)",negative,
687,"The teams have worked hard and within a short span of one week traced 361 lost mobile phones, arrested two offenders who stole them using latest technology and human intelligence, says Prakasam SP",positive,
688,"(marketscreener.com) Trondheim, 12 July 2024:&nbsp;Reference is made to the stock exchange notice released on 27 June 2024 regarding NORBIT ASA's acquisition of 100 per cent of the equity interest in the technology company INNOMAR Technologie GmbH , the market leader in the field of sub-bottom profilers in the maritime industry. The transaction has today...https://www.marketscreener.com/quote/stock/NORBIT-ASA-60103203/news/NORBIT-ASA-Closing-of-NORBIT-s-acquisition-of-the-maritime-technology-company-Innomar-47373004/?utm_medium=RSS&utm_content=20240712",neutral,
689,"(marketscreener.com) Parvis Invest Inc. , a technology-driven private investment company dedicated to democratizing access to institutional quality private investments, proudly announces the expansion of its operations into Atlantic Canada welcoming a new Halifax based client, Keystone Capital Group Ltd., a private lender based in Halifax which offers private...https://www.marketscreener.com/quote/stock/PARVIS-INVEST-INC-151856033/news/Parvis-Expands-Its-Reach-into-Atlantic-Canada-Welcoming-a-New-Issuer-47372974/?utm_medium=RSS&utm_content=20240712",positive,
690,"Segundo um comunicado do Ministério dos Transportes angolano, a outra proposta admitida ao concurso para explorar o novo aeroporto de Luanda é um consorcio constituído pela China National Aero-Technology International Engineering Corporation (CAIEC) e peloYunnan Airport Group Co., Ltd.",neutral,
691,"Northern Technologies International (NASDAQ:NTIC) Announces Earnings Results, Misses Estimates By $0.13 EPS",neutral,
692,"SSDs are in demand for advanced technologies, but that&#39;s not the only reason why prices have surged. We&#39;ve got the details for you here.",positive,
693,"Illustration by Cath Virginia / The Verge | Photos by Getty Images The AI Act is a sweeping set of rules for technology companies operating in the EU, which bans certain uses of AI tools and puts transparency requirements on developers. The law officially passed in March after two years of back and forth and includes several phases for compliance that will happen in waves.Now that the full text has been published, it officially starts the clock for compliance deadlines that companies must meet. The AI Act will come into law in 20 days, on August 1st, and future deadlines will be tied to that...",positive,
694,"In the fast-paced world of mobile technology, app developers are constantly seeking ways to speed up app downloads. We&#8217;ve gathered insights from CEOs to software engineers, covering seven expert strategies to make your apps lightning-fast. From streamlining code for a smaller file size to keeping apps lean for performance, discover the essential tips for enhancing [&#8230;]The post How Can You Make Apps Download Faster On Mobile Devices? appeared first on NewsReports.",positive,
695,The biggest technology companies are allegedly swallowing up the talent.,negative,
696,Seeking Alpha's top Quant picks in Information Technology as Q2 earnings approach,positive,
697,"Der Relative Strength Index (RSI) ist ein technischer Indikator, der dazu verwendet wird, zu bestimmen, ob ein Wertpapier überkauft oder überverkauft ist. Dabei werden die Auf- und Abwärtsbewegungen eines Basiswerts über die Zeit ins Verhältnis gesetzt. Der RSI der letzten sieben Tage für die Sinohope-Aktie liegt aktuell bei 61. [mehr]",neutral,
698,"WESTFORD, Mass., July 12, 2024 /PRNewswire/ -- According to SkyQuest, the global Artificial Intelligence (AI) in Cybersecurity Market size was valued at USD 18.36 Billion in 2022 and is poised to ...",negative,
699,"Meridian group, società internazionale che si occupa di servizi di cyber intelligence finalizzati alla protezione proattiva, ha annunciato di aver raggiunto un accordo con Olidata, azienda italiana leader nel settore dei servizi di information technology ed office automation, quotata su Euronext Milano. Di che si tratta? “In sinergia con le divers...",neutral,
700,The owner said she wants to work with a council that isn't 'hostile to business'.,positive,
701,"Caitlin Clark has been a busy woman in 2024. Busy making jumpers, busy breaking records, and busy winning awards. Last week, the superstar Clark won the ESPY Award for &#8220;Best Record-Breaking Performance.&#8221; In doing so, Clark once again made history. The No. 1 overall pick in this year&#8217;s WNBA Draft became the first woman athlete Read more...The post Caitlin Clark on ESPY win: &#8216;Hopefully it’s the start to women getting more recognition&#8217; appeared first on Awful Announcing.",positive,
702,"By Omar Faruk MOGADISHU, Somalia (AP) &#8212; A bombing outside a cafe Sunday in the Somali capital of Mogadishu killed at least five people, police said. Some people were watching the European soccer final between Spain and England on a screen inside the cafe when a car loaded with explosives blew up outside, said Maj. [&#8230;]",negative,
703,"Betroffene Firmen wehren sich vor Bundesgericht gegen die Einschränkung von Temporärwohnungen. Neue Zahlen zeigen, dass für die Branche viel auf dem Spiel steht.",neutral,
704,"The ASX is primed to open up 0.6 per cent and push on to a new record above 8,000 points after a strong lead from Wall Street on Friday's close. Follow the day's events and insights from our business reporters on the ABC News live markets blog. ",positive,
705,"Witnesses say an explosion has taken place outside a café in the Somali capital of Mogadishu, where attacks by an Islamic militant group are frequently reported. There were no immediate reports of casualties. Some people were watching the European soccer final between Spain and England on screens inside the café when the explosion happened. Pictures posted online and purporting to be from the scene showed a fire burning outside the café. The seaside city, which is sporadically targeted by the al-Shabab militant group, has been relatively peaceful in recent months.",positive,
706,"With around 350,000 homes and businesses still without power in the Houston area almost a week after Hurricane Beryl hit Texas, Gov. Greg Abbott says he&rsquo;s demanding an investigation into the response of the utility that serves the Houston area",neutral,
707,"With around 350,000 homes and businesses still without power in the Houston area almost a week after Hurricane Beryl hit Texas, Gov. Greg Abbott says he’s demanding an investigation into the response of the utility that serves the Houston area. Speaking Sunday at his first news conference about Beryl since returning to the state from an economic development trip to Asia, Abbott said that he also is asking for answers from CenterPoint Energy, which serves the Houston area, about its preparations for upcoming storms.",positive,
708,"Mbulelo Mpofu, mbulelo.smpofu@gmail.com NESTLED in the heart of Matabeleland North province lies the Tsholotsho Business Centre, home to a talented seven-member maskandi musical group, Menz’Omuhle which is seeking to make its mark on the vibrant Zimbabwean music scene.  However, the group, known for their rich cultural sounds and captivating performances, is facing significant financial challenges that [&#8230;]",positive,
709,"By Jamie Stengle DALLAS (AP) &#8212; With around 350,000 homes and businesses still without power in the Houston area almost a week after Hurricane Beryl hit Texas, Gov. Greg Abbott on Sunday said he&#8217;s demanding an investigation into the response of the utility that serves the area as well as answers about its preparations for [&#8230;]",positive,
710,"Associated Press MOGADISHU, Somalia (AP) — Witnesses say an explosion has taken place outside a café in the Somali capital of Mogadishu, where attacks by an Islamic militant group are frequently reported. There were no immediate reports of casualties. Some people were watching the European soccer final between Spain and England on screens inside the",positive,
711,"Associated Press MOGADISHU, Somalia (AP) — Witnesses say an explosion has taken place outside a café in the Somali capital of Mogadishu, where attacks by an Islamic militant group are frequently reported. There were no immediate reports of casualties. Some people were watching the European soccer final between Spain and England on screens inside theThe post An explosion takes place outside a busy café in the Somali capital, witnesses say appeared first on KVIA.",positive,
712,"Toronto, July 14, 2024 (GLOBE NEWSWIRE) &#8212; With more than 38,0000 restaurants and bars, Ontario proudly boasts an estimated 14,000 restaurant and bar locations that serve alcohol.  With summer in full-swing, the next month and a half represent a critical make-or-break window for businesses who offer LCBO purchased products who are highly dependent on tourists, [&#8230;]",positive,
713,"Spain vs England Live, Euro Final: Palmer equalises, Spain 1-1 England&nbsp;&nbsp;Hindustan TimesSpain vs England LIVE score, Euro 2024 final : ESP 0-0 ENG; UEFA European Championship finale updates&nbsp;&nbsp;SportstarLIVE: Spain vs England – UEFA Euro 2024 final&nbsp;&nbsp;Al Jazeera EnglishSpain - England live: Euro 2024 - Football&nbsp;&nbsp;Eurosport COMEuro Cup 2024 FINAL Spain vs England LIVE SCORE: ESP 1 | 1 ENG in 2nd half - Palmer levels the score&nbsp;&nbsp;Business Standard",positive,
714,"Parkway PlazaEl CajonParkway Plaza remodelNewsPoliticsCommunitiesEast County Shopping &amp; Business DirectoryEl CajonCity awaits Council’s next motionBy Rachel WilliamsJuly 14.2024 (El Cajon) -- With online sales taking a bite out of retail traffic, shopping malls across the U.S. are struggling and some have closed down. Seeking to avoid that scenario, the City of El Cajon commissioned a market analysis envisioning redevelopment options for Parkway Plaza,  East County’s largest regional shopping mall.Council members unanimously favored a motion to move beyond proposed aspirational...",positive,
715,"South Korea has finalized the minimum wage for 2025 at 10,030 won ($7.3) per hour, marking the first time the compulsory hourly minimum wage has surpassed 10,000 won. The tripartite Minimum Wage Commission, which is composed of nine members each from labor, business and the public sector, opted for an increase of 170 won, or 1.7 percent, from last year&rsquo;s rate of 9,860 won. It is the second-lowest increase on record, in percentage terms. The new rate translates as 2.1 million won per month,",positive,
716,"It appeared almost everyone was watching the tense Euro final clash, leaving usually busy roads completely empty",negative,
